55;Нет отпуска тормозов локомотива, в кабине управления кран машиниста во 2-ом положении, кран вспомогательного тормоза в положении отпуска.;Включение устройства блокировки тормозов в задней секции электровоза.;В кабине управления падение давления в тормозной магистрали и в уравнительном резервуаре до 0,2 МПа, сброс воздуха через реле давления блока вспомогательного тормоза (БВТ). В шкафу УКТОЛ нерабочей секции отсоединить разъем от вентиля В1 и нажатием на грибок вентиля В2 отключить устройство блокировки тормозов.
;;Неисправность реле давления блока вспомогательного тормоза.;Перекрыть кран КН4 при дальнейшем следовании управление вспомогательным тормозом осуществлять поездным краном.
;;Срабатывание вентилей ЭПВН (срыва рекуперации).;"Наполнение тормозных цилиндров обеих секций до давления
0,13-0,18 МПа. На блоках тормозного оборудования обеих секций (БТО) отсоединить разъемы от вентилей ЭПВН, после отсоединения происходит выпуск воздуха через них из управляющей камеры реле давления БТО в атмосферу и отпуск тормозов локомотива."
Примечание: на торможение электровоза краном вспомогательного тормоза влияет реле давления БВТ той секции, где включена блокировка тормозов.;;;
56;Нет отпуска тормозов одной секции локомотива, в кабине управления кран машиниста во 2-ом положении, кран вспомогательного тормоза в положении отпуска.;Срабатывание устройства торможения при разрыве секций.;Наполнение тормозных цилиндров секции до давления 0,35-0,37 МПа. На блоке тормозного оборудования секции перекрыть кран КрРШ7, будет происходить выпуск воздуха через атмосферное отверстие крана, для полного отпуска использовать кнопку отпуска тормозов локомотива SA47 в кабине управления.
;;Неисправен БВР секции;Перекрыть кран КрРФ, выпустить воздух из запасного резервуара через отпускной клапан главной части, для полного отпуска использовать кнопку отпуска тормозов локомотива SA47 в кабине управления.
57;Нет отпуска тормозов одной тележки локомотива.;Неисправность реле давления БТО.;Под плитой БТО перекрыть соответствующий кран КН9 или КН10 от реле давления к тормозным цилиндрам тележки.
58;Самопроизвольное наполнение тормозных цилиндров секции.;Пропуск вентиля ЭПВН.;Давление в тормозных цилиндрах в пределах 0,13-0,18 МПа. На БТО перекрыть кран КрРШ3 и ослабить крепление вентиля ЭПВН. Помнить, что при срыве электрического торможения не будет наполнения тормозных цилиндров секции.
59;При сборе схемы электрического торможения наполнение тормозных цилиндров секции.;Пропуск манжеты от питательной магистрали электроблокировочного клапана КЭБ1.;Отсоединить разъем от вентиля клапана КЭБ1. При сборе схемы электрического торможения помнить о возможности наполнения тормозных цилиндров от приборов управления тормозами (не будет работать КЭБ1 на совместное применение электрических и пневматических тормозов).
60;При торможении краном вспомогательного тормоза нет наполнения тормозных цилиндров локомотива.;ВЦУ включено, устройство блокировки тормозов включено - неисправно реле давления БВТ.;Перекрыть кран КН4 при дальнейшем следовании управление вспомогательным тормозом осуществлять поездным краном.
;;Неисправность крана вспомогательного тормоза.;Проворот ручки крана на стакане: закрепить ручку или для торможения использовать гаечный ключ на 22.
61;При торможении краном вспомогательного тормоза или краном машиниста нет наполнения тормозных цилиндров одной тележки.;Неисправность реле давления БТО.;На БТО перекрыть краны КрРШ1 и КрРШ5 для реле давления первой тележки или КрРШ2 и КрРШ6 для реле давления второй тележки.
62;При торможении краном машиниста нет наполнения тормозных цилиндров какой-либо секции;Неисправность БВР или западание одного из переключательных клапанов БТО.;По датчику разрыва тормозной магистрали проверить срабатывание БВР на торможение. Если после ступени торможения лампа ТМ в кабине загорается и гаснет, то неисправен какой-то переключательный клапан БТО. Дальнейшее следование с контролем срабатывания тормозов секции. Если лампа ТМ загорается и не гаснет неисправен БВР. Отключить БВР краном КрРФ, выпустить воздух из запасного резервуара через отпускной клапан главной части. Контроль разрыва тормозной магистрали через сигнализатор исправной секции по монитору в кабине управления.
Примечание: при работе БЭПП при наличии питания на вентилях загорается светодиод.;;;
63;При постановке ключа ВЦУ в положение 1 не включается блокировка тормозов.;Обрыв в цепи питания или неисправность вентиля В1.;В шкафу УКТОЛ проверить поступление питания на блок управления БЭПП (при положениях 1 и 2 ключа ВЦУ горит четыре севтодиода) нажать на грибок вентиля В1 (принудительно включить устройство блокировки тормозов). Убедиться в поступлении питания на вентиля УКТОЛ в соответствии с положением ручки крана машиниста усл N 130.
;;Неисправность блокировки тормозов.;Вентиль В1 постоянно находится под питанием. Неисправно устройство блокировки тормозов (УБТ) заменить на УБТ снятое с БЭПП нерабочей кабины.
64;Непрерывная разрядка уравнительного резервуара и тормозной магистрали при 2-ом положении ручки крана машиниста.;Потеря питания вентилей В4 и В5 на БЭПП.;В шкафу УКТОЛ проверить наличие питания на вентилях В4 и В5 БЭПП, если светодиоды не горят - нарушение контакта в разъеме одной из кнопок экстренного торможения в кабине управления. Перейти на управление автоматическими тормозами от крана резервного управления (КРУ).
65;Занижение давления в уравнительном резервуаре при 2-ом положении ручки крана машиниста.;Обрыв питания в вентиле В4 или неисправность редуктора БЭПП.;В шкафу УТОЛ проверить наличие питания на вентиле В4, при отсутствии питания использовать вентиль с нерабочего БЭПП или перейти на управление КРУ.
66;При постановке ручки крана машиниста в 1 положение нет сверхзарядки уравнительного резервуара и тормозной магистрали.;Неисправность вентиля В3 или питательного клапана.;Использовать отпуск вторым положением ручки крана машиниста при наличии времени переставить вентиль с питательным клапаном с нерабочей плиты.
67;Завышение давления в тормозной магистрали при 2-ом положении ручки крана машиниста.;Неисправность редуктора БЭПП или пропуск питательного клапана.;Если после постановки ручки крана машиниста в 4-е положение завышение прекратилось, неисправен редуктор, если завышение продолжается пропуск питательного клапана. При неисправности редуктора использовать редуктор с нерабочей плиты, аналогично поступают питательным клапаном.
68;При завышении давления в уравнительном резервуаре нет завышения в тормозной магистрали.;Неисправность реле давления БЭПП.;Перейти на управление КРУ.
69;При ступени торможения нет разрядки тормозной магистрали.;Неисправность реле давления БЭПП.;Перейти на управление КРУ.
Примечание: если после постановки ручки крана машиниста в положение служебного торможения нет разрядки уравнительного резервуара в шкафу УКТОЛ кран переключения режимов (КПР) установлен в положение КРУ.;;;
;;;
