к Перечню действий локомотивных;;;
бригад по выявлению и устранению;;;
неисправностей на локомотивах;;;
при поездной и маневровой работе;;;
;;;
Порядок действий локомотивных бригад по выявлению и устранению неисправностей на электровозах 2ЭС6;;;
;;;
N;Неисправность;Возможная причина;Способ устранения
Высоковольтные цепи;;;
1;При поднятом токоприемнике снимается напряжение в контактной сети, возможно с появлением вспышек, дыма, искр характерных для короткого замыкания в местах расположения крышевого оборудования.;"Возможные места возникновения короткого замыкания крышевого оборудования:
- пробой опорных изоляторов токоприемника и помехоподавляющего дросселя;
- пробой опорного изолятора подвижного ножевого контакта разъединителя;
- повреждение ограничителя перенапряжений;
- излом токоприемника с касанием его элементов заземленных частей крыши электровоза;";"Опустить токоприемник и отключить БВ QF1. На аварийной секции в шкафу МПСУ и Д отключить тумблер SA1 ""Токоприемник"" в положении ""выключено"" и перекрыть кран на магистрали к клапану токоприемника КЭП1. В случае излома токоприемника выполнить все мероприятия согласно действующим инструкциям ОАО РЖД по приведению токоприемника в нерабочее положение.
Дальнейшее следование осуществлять на исправных токоприемниках."
;Повреждение элементов токоприемника без существенных последствий.;Повреждение полоза, рамы и тяг токоприемника без нарушения геометрии.;"Опустить токоприемник и отключить БВ QF1. На аварийной секции в шкафу МПСУ и Д отключить тумблер SA1 ""Токоприемник"" в положении ""выключено"" и перекрыть кран на магистрали к клапану токоприемника КЭП1.
Дальнейшее следование осуществлять на исправных токоприемниках."
2;При включении БВ происходит его отключение в одной из секций, возможно, со снятием напряжения в контактной сети.;"Короткое замыкание в цепи от подвижного контакта БВ до РДФ1 или РДФ2;";"В шкафу МПСУ и Д отключить БВ неисправной секции тумблером SA2. В кабине управления отключить двигатели неисправной секции переключателями SA28 или SA29.
Следовать на исправных секциях с использованием всех соединений ТЭД с применением последовательного или независимого возбуждения."
;При включении БВ происходит его отключение в одной из секций, со срабатыванием дифференциального реле РДФ1 (КА1).;Пробой изоляции провода 006 от РДФ1 до контакторов К1 и К2, повреждение элементов подвижного контакта реостатных контакторов К1, К2.;"В шкафу МПСУ и Д отключить БВ неисправной секции тумблером SA2. В кабине управления отключить двигатели неисправной секции переключателями SA28 или SA29.
Следовать исправными секциями с использованием всех соединений ТЭД с применением последовательного или независимого возбуждения."
;При включении БВ происходит его отключение в одной из секций, со срабатыванием РДФ2 (КА2).;Пробой изоляции провода 800 от РДФ2 до контактора КМ1;"В шкафу МПСУ и Д отключить БВ неисправной секции выключателем SA2. В кабине управления отключить двигатели неисправной секции переключателями SA28 или SA29.
Следовать на исправных секциях с использованием всех соединений ТЭД с применением последовательного или независимого возбуждения."
3;При включении БВ происходит его отключение в одной из секций, возможно, со снятием напряжения в контактной сети.;"Короткое замыкание в цепи от подвижного контакта БВ до РДФ1 или РДФ2;";"В шкафу МПСУ и Д отключить БВ неисправной секции тумблером SA2. В кабине управления отключить двигатели неисправной секции переключателями SA28 или SA29.
Следовать на исправных секциях с использованием всех соединений ТЭД с применением последовательного или независимого возбуждения."
4;При включении БВ происходит его отключение в одной из секций, со срабатыванием дифференциального реле РДФ1 (КА1).;Пробой изоляции провода 006 от РДФ1 до контакторов К1 и К2, повреждение элементов подвижного контакта реостатных контакторов К1, К2.;"В шкафу МПСУ и Д отключить БВ неисправной секции тумблером SA2. В кабине управления отключить двигатели неисправной секции переключателями SA28 или SA29.
Следовать исправными секциями с использованием всех соединений ТЭД с применением последовательного или независимого возбуждения."
Примечание - для предотвращения последствий короткого замыкания и сохранности оборудования электровоза запрещается включать быстродействующий выключатель, при наличии короткого замыкания в силовой цепи, более двух раз, после чего нужно выявить и устранить неисправность.;;;
5;"При следовании в режиме тяги происходит отключение БВ одной из секций со срабатыванием дифференциального реле КА1, возможно с появлением дыма, вспышки в зоне расположения реостатных и линейных контакторов на первом и втором блоках -
аппаратов.";"Наличие короткого замыкания в следующем оборудовании электровоза:
-силовые диоды VD3- VD5 и VD6- VD8;
- двигатели охлаждения ПТР М11 или М12;
- контакторы К5, К6, К7, К8, подключения двигателей охлаждения ПТР;
- элементы пусковых сопротивлений R3 или R4;
- реостатные контакторы К2, К21, К22, К23 включенные на первой позиции;
- тяговые двигатели М1, М2, М3, М4;
- линейные контактора К27, К29, К30, К31, К32, К34, К36, К39, К40;
- быстродействующие контакторы К41, К42;
- силовые переходные диоды VD9- VD17 и; VD17- VD26;
- составляющие элементы преобразователя СТПР 1000 А7, А8, А12, А13;
- межсекционные соединения.";"Для определения участка или места короткого замыкания необходимо тумблер SA32 поставить в положение ""прицепная"" и собрать схему первой позиции.
Если БВ не отключит, то короткое замыкание в следующем оборудовании головной секции:
- двигатели охлаждения ПТР М11 или М12;
- контакторы К5, К6, К7, К8, подключения двигателей охлаждения ПТР;
- элементы пусковых сопротивлений R3 или R4;
- реостатные контакторы К2, К21, К22, К23 включенные на первой позиции;
Выход из положения:
При взятии поезда с места и последующего разгона необходимо тумблер SA32 оставить в положение ""прицепная"". Следование электровоза осуществляется на двух секциях, только на последовательном соединении ТЭД с использованием последовательного или независимого возбуждения. При необходимости перехода на более высшее соединение ТЭД ""СП"" или ""П"" необходимо перед сбором первой позиции выключить переключателем SA28 двигатели головной секции электровоза и продолжить движение на исправных секциях с использованием всех соединений ТЭД в режиме независимого или последовательного возбуждения.
Если после перевода тумблера SA32 в положение ""прицепная"" и постановке 1 позиции отключит БВ прицепной секции, то короткое замыкание в следующем оборудовании головной секции:
- тяговые двигатели М1, М2, М3, М4;
- линейные контактора К27, К29, К30, К31, К32, К34, К36, К39, К40;
- быстродействующие контакторы К41, К42;
- межсекционные соединения.
Выход из положения:
В кабине управления переключателем SA28 определить неисправную пару (после отключения которой не будет срабатывания защиты). Дальнейшее следование:
С соединение-6-10 двигателей;
СП соединение двигатели прицепных секции;
П соединение-6-10 двигателей."
"Примечание - следует учитывать, что при отключении ТЭД 1, 2 из силовой цепи выводится: Неподвижный контакт контактора К27, контакты 1-6 реверсора QP1, обмотка якоря М1, М2, обмотка возбуждения М1, М2, контакты 1-6 переключателя QP3, подвижный контакт контактора К37, К35, переходные диоды VD18-26, контактор К30, неподвижный контакт контактора К29, СТПР 1000 А7, А12.
При отключении ТЭД 3, 4 из силовой цепи выводятся: Неподвижный контакт контактора К28, контакты реверсора 1-6 QP2, обмотки якоря М3, М4, обмотки возбуждения М3, М4, контактор К32, контакты 1-6 переключателя QP4, подвижный контакт контактора К34, неподвижный контакт контактора К30, СТПР 1000 А8, А13.
При переводе переключателя SA32 в положение ""прицепная"" отключаются пусковые сопротивления и земляная цепь тяговых двигателей головной секции только на последовательном соединении.";;;
Повреждение линейных контакторов;;;
6;В режиме тяги или торможения отключает БВ со срабатывание дифференциального реле КА1 на одной из секций с появлением дыма, вспышек в зоне расположения линейных контакторов на блоках-аппаратов 1 или 2. После постановки первой позиции отключает БВ со срабатыванием дифференциального реле КА1 на секции, где включены пусковые сопротивления.;"Наличие короткого замыкания в следующем оборудовании электровоза:
-силовые диоды VD3- VD5 и VD6- VD8;
- двигатели охлаждения ПТР М11 или М12;
- контакторы К5, К6, К7, К8, подключения двигателей охлаждения ПТР;
- элементы пусковых сопротивлений R3 или R4;
- реостатные контакторы К2, К21, К22, К23 включенные на первой позиции;
- тяговые двигатели М1, М2, М3, М4;
- линейные контактора К27, К29, К30, К31, К32, К34, К36, К39, К40;
- быстродействующие контакторы К41, К42;
- силовые переходные диоды VD9- VD17 и; VD17- VD26;
- составляющие элементы преобразователя СТПР 1000 А7, А8, А12, А13;
- межсекционные соединения.";"Переключателем SA32 отключить пусковые сопротивления секции, где произошло отключение. Осмотреть состояние контакторов и шин на блоках аппаратов 1 и 2. Если следов повреждения нет, то в кабине управления переключателем SA28 отключить двигатели 1 и 2 собрать первую позицию, проконтролировав из машинного отделения работу аппаратов на блоках 1 и 2. Если защита сработает, короткое замыкание в цепи двигателей второй тележки.
Выход из положения: отключить двигатели 3 и 4
Дальнейшее следование:
С соединение-6-10 двигателей;
СП соединение двигатели исправных секции;
П соединение-6-10 двигателей.
Если при отключении двигателей 1 и 2 защита не сработает, то короткое замыкании в цепи двигателей первой тележки."
7;В режиме тяги отключает БВ со срабатывание дифференциаль-ного реле КА1 на одной из секций с появлением дыма, вспышек в зоне расположения двигателей охлаждения ПТР.;Короткое замыкание в цепи двигателей охлаждения ПТР М11 или М12, возможно заклинивание одного из вентиляторов.;Осмотреть состояние контакторов К3, К4, К5, К6, К7, К8 на блоке аппаратов N 3, если следов перекрытия контакторов не обнаружено в кабине управления тумблером SA32 вывести ПТР неисправной секции. При необходимости перехода на СП или П соединения переключателем SA28 вывести двигатели неисправной секции.
Повреждение силовых диодов;;;
8;В процессе движения при сборе первой позиции большое значение тока якоря, а при трогании с места или малой скорости движения срабатывание защиты.;"- сбой в программном обеспечении;
-заклинивание, во включенном положении, реостатных контакторов;
-пробой силовых диодов VD3- VD5 и VD6- VD8.";"Проверить порядок включения контакторов на секции, где происходят недопустимые броски тока. Если нарушений нет перевести тумблер SA32 в положение включения пусковых сопротивлений на этой секции и собрать схему первой позиции. Если наблюдается недопустимый бросок тока на первой позиции- неисправны диоды VD3- VD5 и VD6- VD8.
Выход из положения: Отключить неисправную секцию переключателем SA28 и следовать исправными секциями."
9;Недопустимые броски тока при переходе с одного соединен ия двигателей на другое, возможно отключение защиты через дифферениадьное реле КА1.;"Пробой силовых диодов
VD9- VD17 и; VD18- VD26
VD9- VD17 VD18- VD26";Отключить неисправную секцию переключателем SA28 и следовать исправными секциями.
Цепь питания ПСН-200;;;
10;Отключает БВ на одной из секций со срабатыванием дифференциального реле КА2;"Короткое замыкание в цепи ПСН-200
РН3000 А2-1";"Для определения места короткого замыкания в шкафу МПСУ и Д выключить тумблер ПСН SA17, включить БВ. Если защита сработает, то короткое замыкание в цепи от БВ до контактора КМ1 (пр 800).
Выход из положения: В шкафу МПСУ и Д отключить БВ неисправной секции выключателем SA2. В кабине управления отключить двигатели неисправной секции переключателем SA28.
Следовать на исправных секциях с использованием всех соединений ТЭД с применением последовательного или независимого возбуждения.
Если защита не сработает, дополнительно на блоке аппаратов N 3 все ножи QR1 - QR6 поставить в среднее положение и включить БВ. Если после включения контакторов КМ1 и КМ2 сработает защита, то короткое замыкание в цепи от контакторов до ""Шкафа защиты"" (провод 803)
Выход из положения: В шкафу МПСУ и Д отключить ПСН неисправной секции тумблером SA17. В кабине управления отключить двигатели неисправной секции выключателями SA28 или SA29.
Следовать на исправных секциях с использованием всех соединений ТЭД с применением последовательного или независимого возбуждения.
Если после отключения QR1 - QR6 защита не сработает, то короткое замыкание в преобразователях. Необходимо последовательным включением ножей QR1 - QR6 определить место короткого замыкания.
Если срабатывание защиты произошло после включения QR1 - несправен РН3000 А2-1.
Выход из положения: QR1 поставить в нижнее положение(отключить РН3000 А2-1) в кабине управления тумблер SB14 переставить в положение ""последовательное"", дальнейшее следование на последовательном возбуждении тяговых двигателей."
;;"Короткое замыкание в цепи ПСН-200
РН3000 А2-2";"Если срабатывание защиты произошло после включения QR2 - неисправен РН3000 А2-2.
Выход из положения: QR2 поставить в нижнее положение.
(отключить РН3000 А2-2) в кабине управления тумблер SB14 переставить в положение ""последовательное"", дальнейшее следование на последовательном возбуждении тяговых двигателей."
Примечание - при отключении РН3000 А2-1 или А2-2 по причине неисправности, управление электровозом производится только на последовательном возбуждении ТЭД (автоматически по команде МПСУ и Д при резервировании РН3000 или путем переключения выключателя SA19).;;;
11;Отключает БВ на одной из секций со срабатыванием дифференциального реле КА2;"Короткое замыкание в цепи ПСН-200
СТПР-600(А2-3)";"Срабатывание защиты при включении QR4.
Разъединитель устанавливается в среднее положение.
Не будет включаться вентилятор охлаждения тяговых двигателей 1-2 и не работает система микроклимата.
Выход из положения: Переключателем SA28 отключить двигатели 1-2, тумблер SB14 переставить в положение ""последовательное"", дальнейшее следование на шести или десяти тяговых двигателях при последовательном возбуждении ТЭД."
;;"Короткое замыкание в цепи ПСН-200
СТПР-600(А2-4)";"Срабатывание защиты при включении QR5.
Разъединитель устанавливается в среднее положение
Не будет включаться вентилятор охлаждения тяговых двигателей 3-4 и компрессор.
Выход из положения: Переключателем SA28 отключить двигатели 3-4, тумблер SB14 переставить в положение ""последовательное"", дальнейшее следование на шести или десяти тяговых двигателях при последовательном возбуждении ТЭД и компрессоре исправной секции."
