;;"Не открылся впускной клапан компрессора (на пульте управления компрессора не загорается сигнальная лампа ""впускной клапан"").";"компрессор работает на ""холостом ходу"" из-за пониженной температуры масла (ниже 5°С): при работе компрессора на ""холостом ходу"" выждать время нагрева масла до температуры выше 5°С;"
;;Нет сигнала от датчика давления питательной магистрали;"по монитору проверить наличие показаний давления питательной магистрали и перейти на управление компрессорами через кнопку ""компрессора принудительно"", контролируя давление питательной магистрали по манометру в кабине управления."
"Примечание: перед проверкой цепи управления компрессором проверить включенное положение АЗВ SF3 ""Вспомогательный компрессор"".";;;
30;"После постановки джойстика SA45 в положение ""+1"" нет набора позиций";"не развернуты реверсора в положение направления движения;";"По монитору в кабине управления проверить соответствие положения реверсоров (разворачиваются вручную нажатием на грибок электропневматического вентиля привода);"
;;"не развернуты режимные переключатели в положение ""последовательное"" или ""независимое"";";"по монитору в кабине управления проверить соответствие положения режимных переключателей (разворачиваются вручную нажатием на грибок электропневматического вентиля привода);"
;;давление в тормозной магистрали ниже 0,40МПа;по монитору в кабине управления проверить наличие давления в тормозной магистрали, если сигнал не соответствует действительности снять разъем с датчика давления тормозной магистрали в шкафу УКТОЛ
;;напряжение в контактной сети менее 2200 В или более4000 В;сбор схемы тягового режима при напряжении контактной сети в пределах 2200 - 4000 В
31;"После постановки джойстика SA45 в положение ""+1"" набор позиций происходит, но через малый промежуток времени происходит разбор тяги";Не включился контактор К30;Если не включился контактор К30 необходимо по монитору проверить состояние линий связи и БУК, для работы схемы переключателем SA28 вывести любую пару двигателей головной секции.
;;Не включился контактор К36;Если не включился контактор К36 необходимо по монитору проверить состояние линий связи и БУК, отключить тяговые двигатели неисправной секции. дальнейшее следование на ТЭД исправных секций
;;"Не включился контактор К39 в положении тумблера SA32 ""головная""";"Если не включился контактор К39 необходимо по монитору проверить состояние линий связи и БУК, тумблер SA32 перевести в положение ""прицепная"""
;;"Не включился контактор К40 в положении тумблера SA32 ""прицепная"".";"Если не включился контактор К40 необходимо по монитору проверить состояние линий связи и БУК, тумблер SA32 перевести в положение ""головная""."
;;Не открылись жалюзи.;"Тумблер SA32 перевести в положение ""прицепная"" и следовать до станции на последовательном соединении ТЭД. На стоянке с помощью изоляционной рукоятки перевести все жалюзи в открытое положение, проверить замкнутое состояние блокировок жалюзи в ВВК и по мониторам в кабине управления."
32;При переходе с С на СП через 2-5 секунд происходит разбор тяги;Задержка по времени включения или не включение контакторов К37 и К38 на .какой-либо секции.;По мониторам в обеих кабинах проверить состояние линий связи и БУК, проверить включение контакторов К37 и К38 на обеих секциях. Если контактора на включаются следование на последовательном соединении всеми двигателями, при необходимости перехода на высшее соединение ТЭД переключателем SA28 отключить двигатели неисправной секции.
32;При переходе с СП на П через 2-5 секунд происходит разбор тяги;Задержка по времени включения или не включение контактора К28;По мониторам в обеих кабинах проверить состояние линий связи и БУК, проверить включение контактора К28 на обеих секциях. Если контактор не включается дальнейшее следование на С и СП соединениях ТЭД.
Короткое замыкание в цепи питания цепей управления и приводов аппаратов;;;
33;После включения АБ отключается АЗВ SF19 или происходит значительная просадка напряжения цепей управления и отключаются оба монитора.;Короткое замыкание в элементах АБ;АЗВ SF19 не включать, запустить электровоз, используя АБ исправной секции.
34;Срабатывание SF35;Короткое замыкание в проводе 309;После восстановления повторное срабатывание SF35. АЗВ не восстанавливать, проверить состояние SF35 на задней секции, если включен отключить, проверить состояние бортовой сети задней секции. Если напряжение в норме и работают оба монитора задней кабины дальнейшее следование с выключенными SF35 обеих секций. Питание бортовой сети каждой секции от своего ПЧ.
35;Срабатывание SF34;Короткое замыкание в проводе 307;После восстановления повторное срабатывание SF34. АЗВ не восстанавливать, проверить состояние SF34 на задней секции, если включен отключить, проверить состояние бортовой сети задней секции Если напряжение в норме дальнейшее следование с выключенными SF34 обеих секций. Питание бортовой сети каждой секции от своего ПЧ.
36;Срабатывание АЗВ SF10;"Короткое замыкание в цепи источника питания G1 ""системы безопасности"".";АЗВ не восстанавливать, питание приборов безопасности по резервному каналу через МКС.
37;Срабатывание АЗВ SF11;Короткое замыкание в цепи источника питания G2;АЗВ не восстанавливать, питание систем ПСН по резервному каналу
38;Срабатывание АЗВ SF9;Короткое замыкание в цепи источника питания G3;АЗВ не восстанавливать, питание систем ПСН по резервному каналу
39;Срабатывание АЗВ SF13;Короткое замыкание в цепи источника питания G4;АЗВ не восстанавливать, питание систем МСУЛ по I каналу в кабине управления работает один монитор., питание УКТОЛ по резервному каналу через МКС
40;Срабатывание АЗВ SF14;Короткое замыкание в цепи источника питания G6;АЗВ не восстанавливать, питание систем МСУЛ по II каналу, в кабине управления работает один монитор.
41;Срабатывание АЗВ SF3;Короткое замыкание в цепи управления вспомогательным компрессором или компрессорным агрегатом.;"В кабине управления отключить тумблеры ""вспомогательный компрессор и ""компрессор"", восстановить АЗВ:
-если не сработает включить тумблер ""компрессор"", в случае срабатывания короткое замыкание во внутренней цепи агрегата. АЗВ не восстанавливать, дальнейшее следование на одном компрессоре.
-если АЗВ срабатывает после восстановления короткое замыкание в цепи электромагнитного клапана KP11 или реле KL11. В шкафу МПСУ и Д извлечь реле KL11. Дальнейшее управление компрессорами кнопкой принудительного включения компрессоров."
42;"Срабатывание АЗВ SF1 после включения тумблера ""токоприемник""";Короткое замыкание в цепи включения разъединителей и заземлителей, цепи питания клапана токоприемника.;"Отключить тумблер ""токоприемник"", восстановить АЗВ. В машинном отделении разъединители и заземлители изоляционной рукояткой установить в положение поднятия токоприемника, отсоединить разъемы от электропневматических вентилей разъединителей и заземлителей обеих секций. В кабине управления поочередно включить тумблеры ""токоприемник"". Если АЗВ не сработает, то короткое замыкание в цепи электропневматических вентилей разъединителей и заземлителей, дальнейшее следование на ручном управлении разъединителями и зазамлителями.
Если АЗВ сработает на включение какого-то тумблера ""токоприемник"" исключить использование этого тумблера, дальнейшее следование на токоприемниках с исправной схемой управления."
43;Срабатывание АЗВ SF1 после включения тумблера БВ.;Короткое замыкание в цепи включения БВ;"АЗВ на неисправной секции отключить, переключателем SA28 отключить двигатели секции, тумблер SA32 в положение ""прицепная"". Дальнейшее следование на исправных секциях."
44;Срабатывание АЗВ SF1 после постановки первой позиции.;Короткое замыкание в цепи управления жалюзи.;В высоковольтной камере принудительно открыть жалюзи с обеих сторон, за шкафом МПСУ и Д от клапана КР10 отсоединить разъем. Тумблер SA32 перевести на секцию с исправным клапаном КР10. Дальнейшее следование обычным порядком.
45;Срабатывание АЗВ SF1 после ступени торможения краном машиниста;Короткое замыкание в цепи датчика обрыва тормозной магистрали;На срабатывающей секции в шкафу УКТОЛ при выключенном SF1 отсоединить и заизолировать провод 320 в клеммой коробке датчика 418на главной части блока воздухораспределителя.
Неисправности пневматического оборудования;;;
46;Малая производительность компрессорных установок;сброс воздуха из главных резервуаров после остановки компрессора;по манометру компрессора убедиться в падении давления в магистрали компрессора до 0 кгс\см2, если не падает, засорение или перемерзание обратного клапана электровоза в открытом положении, отогреть и обстучать обратный клапан
47;Срабатывание предохранительного клапана компрессора;Неисправность пневматической сети компрессора;Отключить компрессор кнопкой аварийной остановки
48;Перегрев масла;"Неисправность термостатического клапана компрессора;
Низкий уровень масла в маслоотделителе;";Отключить компрессор кнопкой аварийной остановки
;;Воспламенение масла в винтовом модуле;Следы нагара на сепараторе компрессора и почернение масла в маслоотделителе, отключить компрессор кнопкой аварийной остановки.
49;При работе компрессорных установок срабатывание предохранительных клапанов на одной из секций;"Перемерзание обратного клапана.
Неисправность датчика давления питательной магистрали.";"Выключить компрессор нажатием кнопки аварийной остановки, дальнейшее следование осуществляется на одном компрессоре.
Сравнить давления воздуха по манометру в кабине управления, по мониторам в кабине управления и при работающих компрессорах на манометрах блоках управления компрессором. При низком показании давления (меньше чем показания манометра в кабине управления) или отсутствии показаний на мониторах перейти на ручное управления компрессорами."
;Срабатывание первого от компрессора предохранительного клапана;Перемерзание влагомаслотделителя под кузовом электровоза;Выключить компрессор нажатием кнопки аварийной остановки, дальнейшее следование осуществляется на одном компрессоре.
;Срабатывании второго от компрессора предохранительного клапана.;Перемерзание крана КН8 под кузовом электровоза.;При перекрытии крана КН8 на исправной секции наблюдается большое падение давления в питательной магистрали. На стоянке отогреть трубопровод и кран КН8.
50;Отсутствие или заниженное давление в магистрали цепей управления.;Засорение или западание питательного клапана редуктора.;Закрутить регулировочный винт редуктора цепей управления, если не поможет на стоянке перекрыть краны КН8 на обеих секциях, выпустить воздух из питательной магистрали и извлечь питательный клапан редуктора. Открыть краны КН8, перейти на управление компрессорам через кнопки принудительного пуска с поддержанием давления в главных резервуарах в пределах 0,70-0,75 МПа.
51;Разрыв межсекционных рукавов;Питательной магистрали;Перекрыть межсекционные концевые краны, работой компрессоров управлять кнопкой принудительного пуска с контролем давления питательной магистрали задней секции на ближайшей станции рукава заменить.
;;Тормозной магистрали;Использовать рукава питательной магистрали.
52;Повреждение питательной магистрали;Повреждение предохранительных клапанов, обратного клапана, главных резервуаров, влагомаслоотделителя.;Отключить компрессор неисправной секции кнопкой аварийной остановки на блоке управления компрессором, перекрыть кран КН8 под кузовом электровоза. Дальнейшее следование с работающим компрессором и главными резервуарами одной секции.
;;Повреждение питательной магистрали в кузове электровоза.;"Если повреждение произошло на головной секции, заказать вспомогательный локомотив. Если на задней секции, перевести секцию в холодное состояние, перекрыть концевые краны, перекрыть краны КН1, КН2, КН4, на блоке тормозного оборудования открыть кран КрРШ4, перекрыть краны к ЭПК, перенести управление на исправную секцию. На исправной секции переключателем SA28 отключить двигатели неисправной секции, тумблер SA32 поставить в положение ""головная"", Дальнейшее следование на исправных секциях."
53;Повреждение воздухопроводов цепей управления электровоза.;Повреждение резервуара для поднятия токоприемников РС6.;Не использовать кнопку вспомогательный компрессор.
;;Не использовать кнопку вспомогательный компрессор.;"Перекрыть кран КН7, переключателем SA28 отключить двигатели неисправной секции, тумблер SA32 поставить в положение ""головная"", Дальнейшее следование на исправных секциях."
;;Повреждение приводов аппаратов:;
;;Жалюзи;Перекрыть кран КН29, жалюзи открыть принудительно.
;;Токоприемники;Перекрыть кран КН28, в шкафу МПСУ и Д тумблером SA1 отключить токоприемник, дальнейшее следование на исправных токоприемниках.
;;Разъединитель;Перекрыть кран КН31, включение и выключение аппарата вручную.
;;Заземлитель;Перекрыть кран КН32, включение и выключение аппарата вручную.
54;Повреждение трубопроводов в шкафу УКТОЛ;Повреждение трубопровода от КН2 до БТО.;Перекрыть кран КН2, КН9, КН10 дальнейшее следование с отключенными тормозами секции.
;;Повреждение магистрали вспомогательного тормоза.;Перекрыть концевые краны магистрали вспомогательного тормоза между секциями. Если оставить управление электровозом на секции с неисправной магистралью цепей управления вспомогательным тормозом, перекрыть кран КН4 при дальнейшем следовании управление вспомогательным тормозом осуществлять поездным краном.
;;Разрыв воздухопровода тормозных цилиндров.;Выявить на какой тележке произошел разрыв и кранами КН9 или КН10 отключить тормозные цилиндры секции. Если разрыв произошел от блока тормозного оборудования до кранов КН9 или КН10 отключить реле давления тележки для чего перекрыть краны КрРШ1 и КрРШ5 для первой тележки, КрРШ2 и КрРШ6 для второй тележки.
Неисправности тормозного оборудования;;;
Внимание! При неисправности тормозного оборудования в первую очередь проверить открытое положение разобщительных кранов КН1, КН2, КН3, КН4.КН9 и КН10 - положение вдоль трубы. Проверить открытое положение кранов в шкафу УКТОЛ КрРШ1, 2, 3, 5, 6 и КрРФ - вертикально.;;;
Примечание: при снятии тормозных приборов в шкафу УКТОЛ необходимо разрядить тормозную магистраль, выключить устройство блокировки тормозов и перекрыть краны КН1, КН3, КН4.;;;
