42;"Земля в ""+"" или в ""-"" силовой цепи.";Короткое замыкание плюсовой или минусовой силовой цепи на корпус тепловоза. Сброс нагрузки.;"При КЗ в силовых цепях - установить КТМ на 1 позицию, если защита не сработает, то место нарушения изоляции в ""минусе"" силовых цепей. В этом случае осмотреть ВУ, провода. Если защита сработает и имеет место замыкание на корпус в ""плюсе"" силовых цепей, то в этом случае выключить все ОМ1...ОМ6 и установить КТМ на высокие позиции. Если РЗ не сработает, то КЗ находится в плюсовых цепях ТЭД. Тогда включить все ТЭД и поочередным их выключением выявить неисправный. Если защита сработает и при всех выключенных ТЭД, то место КЗ находится в плюсовых цепях между ВУ, поездными контакторами или в тормозных резисторах. В этом случае осмотреть ВУ, провода, шины, тормозные резисторы. Если же повреждение не обнаружится, тогда выключить РЗ соответствующим виртуальным тумблером на дисплейном модуле и следовать с особой бдительностью и помнить, что такой режим является аварийным, тепловоз следует до основного или оборотного депо."
43;"Сопротивление в ""+"" или ""-"" силовой цепи <500 кОм.";При снижении сопротивления в силовой цепи по плюсу или по минусу.;"При срабатывании реле заземления из-за понижения сопротивления силовой цепи, исключив реальное КЗ в электрооборудовании тепловоза на дисплее ""Реле земли"" выключить соответствующий виртуальный тумблер. После этого усилить контроль за силовыми цепями тепловоза, обратив особое внимание на выпрямительную установку."
44;Защита по РМ 1.;При превышении тока на выходе ВУ более 7800А. СН.;Если сработала защита тягового генератора АГ1 и выпрямительной установки от токов внешнего короткого замыкания, то необходимо тщательно осмотреть генератор и ВУ. Без установления причины нагружать тепловоз запрещается.
45;Нет возбуждения тягового генератора;"На ДМ окно ""Движение"" режим ""тяга"", тепловоз не нагружается и нет ни каких аварийных сообщений.";"Это говорит о том, что схема управления собралась, но нет возбуждения главного генератора.
Перейти на резервный полукомплект компьютера.
При выдаче на дисплее аварийного сообщения: ""Нет самовозбуждения"" или ""Нет связи с БВГ1 или БВГ2"" на картинке ""Система возбуждения"" посмотреть величину напряжения возбуждения. Если напряжение возбуждения менее 50В - кратковременно отключить автоматы БВГ1 и БВГ2 на стенке ВВК. Эту операцию необходимо проделать в любом случае, когда тепловоз не нагружается, а на мониторе режим ""тяга"". При положительном результате компьютер выдаст сообщение ""Самовозбуждение состоялось"". Если этого не произошло, предварительно заглушив дизель, перейти на резервный комплект."
46;Мощность 1/2 номинала, 2/3 номинала, 5/6 номинала.;При отключении 3ТЭД, 2ТЭД, 1ТЭД.;Работа с отключением одного, двух или трех ТЭД
47;Аварийная остановка дизеля.;При выключении тумблера Тб3 в любой кабине. Останов дизеля.;Тумблера должны быть включены и опломбированы.
48;Превышение предельной скорости вращения ТЭД.;Сброс нагрузки при превышении скорости вращения одного из ТЭД более 180 км/ч. Срыв шестерни ТЭД.;Сбросить позиции и набраться вновь. Если защита опять сработает - определить неисправный ТЭД и произвести его отключение соответствующим ОМ (на 0 позиции).
Неисправности системы МСУТ;;;
49;Неисправность дисплейного модуля - дисплей не светится.;"Неисправность питания.
Неисправен ДМ.";"Проверить включение АВ ""Дисплейные модули"" на ВВК.
Проверить контакты разъединителя минусовых цепей управления РЦ2 и контакты разъема 1;3 на ДМ, проверить также крепление интерфейсного кабеля."
;"Неисправность питания блока БУ - мерцает индикатор БП или БПБ.
На БПР (в стойке) мерцают один или несколько индикаторов.
Мерцает индикатор БПД.";Неисправность блоков питания, модулей соответствующего полукомплекта.;"Определить неисправный блок.
Проверить предохранитель, неисправный заменить."
;;Неисправность блока питания датчиков БПД 1.;
;"Индикатор БПА или БПБ горят постоянно. На дисплее надпись ""Нет связи"".";Неправильное подключение или неисправность компьютера.;"Проверьте подключение БПД 1 и предохранитель, неисправный заменить.
Проверить кабель связи компьютера с дисплейным модулем.
Проверить подключение компьютера к системе.
Проверить работу 2-го полукомплекта. В случае невозможности восстановить работу системы, перейти на ручной запуск (схема тяги собираться не будет)."
"Переход на резервный полукомплект на ТЭП70БС:
1. Произвести остановку дизеля нажатием КН2 ""Остановка дизеля"".
2. Отключить:
АВ 1 ""Питание БВГ 1"".
АВ 2 ""Питание БВГ 2"".
АВ 6 ""Питание БУ и датчиков"".
АВ 8 ""Питание исполнительных устройств"".
3. Переключением тумблера перевести управление на резервный полукомплект.
4. Произвести включение автоматических выключателей ""Пуск дизеля"", дальнейшее управление выполнять в установленном порядке.";;;
;;;
